{
  "commit_hash": "fd149cf8c2a9cc3e746322c90cfab507f8cc0be1",
  "timestamp": "2026-03-30T19:46:18Z",
  "invariants_verified": [
    "INVARIANT_01",
    "INVARIANT_02",
    "INVARIANT_03",
    "INVARIANT_04",
    "INVARIANT_05",
    "INVARIANT_06",
    "INVARIANT_07",
    "INVARIANT_08",
    "INVARIANT_09",
    "INVARIANT_10",
    "INVARIANT_11",
    "INVARIANT_12",
    "INVARIANT_13",
    "INVARIANT_14",
    "INVARIANT_15",
    "INVARIANT_16",
    "INVARIANT_17",
    "INVARIANT_18",
    "INVARIANT_19",
    "INVARIANT_20",
    "INVARIANT_21",
    "INVARIANT_22",
    "INVARIANT_23",
    "INVARIANT_24",
    "INVARIANT_25",
    "INVARIANT_26",
    "INVARIANT_27",
    "INVARIANT_28",
    "INVARIANT_29",
    "INVARIANT_30",
    "INVARIANT_31",
    "INVARIANT_32",
    "INVARIANT_33",
    "INVARIANT_34",
    "INVARIANT_35",
    "INVARIANT_36",
    "INVARIANT_37",
    "INVARIANT_38",
    "INVARIANT_39",
    "INVARIANT_40",
    "INVARIANT_41",
    "INVARIANT_42",
    "INVARIANT_43",
    "INVARIANT_44",
    "INVARIANT_45",
    "INVARIANT_46",
    "INVARIANT_47",
    "INVARIANT_48",
    "INVARIANT_49",
    "INVARIANT_50"
  ],
  "acceptance_results": [
    {
      "id": "AC-1",
      "passed": true,
      "detail": "Evidence ledger JSON Schema validation"
    },
    {
      "id": "AC-2",
      "passed": true,
      "detail": "Commit-bound verification artifact generated"
    },
    {
      "id": "AC-3",
      "passed": true,
      "detail": "commit_hash non-empty from git"
    },
    {
      "id": "AC-4",
      "passed": true,
      "detail": "Referential governance chain complete"
    },
    {
      "id": "AC-5",
      "passed": true,
      "detail": "CI commands match EXPECTED_CI_COMMAND_LINES"
    },
    {
      "id": "AC-6",
      "passed": true,
      "detail": "Inventory manifest + MD timestamp sync"
    },
    {
      "id": "AC-7",
      "passed": true,
      "detail": "Failures yield non-zero exit"
    }
  ],
  "failures": [],
  "environment": {
    "python": "3.13.1",
    "platform": "macOS-15.7.5-arm64-arm-64bit-Mach-O",
    "cwd": "/Users/coreyalejandro/Projects/the-living-constitution/projects/consentchain"
  },
  "run_status": "passed",
  "broken_chain_links": [],
  "invariant_failures": [],
  "missing_evidence_explicit": [],
  "schema_validation_errors": [],
  "artifact_path": "verification/runs/20260330T194618Z-governance.json",
  "github_actions_provenance": {},
  "commit_matches_github_sha": true,
  "verify_workflow_sha256": "b4396d799e4a2bfd8280b3cf863419c7d612c5f4d00871fb33d09f972ab001a1"
}
